chapter,Chapter Content,Questions,Answers
14.5 Using Macros," Macros can make tasks that you routinely perform in Access quicker through automation. Macros are built using computer coding language to perform specific tasks such as running reports, printing forms, or copying data from one table into another table By customizing your database with macros, you can create a system for accomplishing many similar operations easily and efficiently. Two common applications for macros are displaying message boxes and validating data. VBA is a programming language that is integrated into Access, allowing you to create custom solutions for data management, reporting, and other tasks. Using the Code Builder tool, you can add specialized macros to forms and reports.","[' What is a macro in Access?', 'What are the two common applications for macros in Access?', 'What is VBA, and how is it integrated into Access?', 'How can you use the Code Builder tool in Access to add specialized macros to forms and reports?', 'What are some practical examples of tasks that can be automated using macros in Access?']","[' A macro in Access is a series of instructions written in a programming language that automates a series of tasks.', 'The two common applications for macros in Access are displaying message boxes and validating data.', 'VBA, or Visual Basic for Applications, is a programming language that is integrated into Access. It allows you to create custom solutions for data management, reporting, and other tasks.', 'You can use the Code Builder tool in Access to add specialized macros to forms and reports. This tool allows you to create and edit VBA code directly within the Access interface.', ' Some practical examples of tasks that can be automated using macros in Access include running reports, printing forms, copying data from one table into another table, and creating a system for accomplishing many similar operations.']"
14.6 Data Analysis and Integration,Integrating data from outside sources may take some planning. Steps for importing and exporting data were reviewed.  Building a dashboard with navigation forms helps drive business. Plan and build your dashboard around forms are used most often in the organization. Review Questions,"[' What are the steps for importing and exporting data?', ' What is the purpose of a dashboard in a business?', ' What are the benefits of planning and building a dashboard around forms?', ' What are the potential challenges in integrating data from outside sources?', "" How can the use of forms in an organization's dashboard help drive business?""]","[' Importing data involves transferring data from one system to another. Exporting data involves transferring data from one system to another.', ' A dashboard in a business provides a centralized view of key performance indicators (KPIs) and allows for quick access to data and reports.', 'The benefits of planning and building a dashboard around forms include improved user experience, increased efficiency, and enhanced data analysis.', 'Potential challenges in integrating data from outside sources include data quality issues, integration complexity, and the need for ongoing maintenance and support.', "" The use of forms in an organization's dashboard can help drive business by providing a centralized platform for data input, analysis, and decision-making.""]"
15.1 Microsoft 365: Collaboration and Integration,"Collaborative workspaces allow users from various physical locations to work together efficiently.  Office is designed to allow easy integration between applications. We discuss two types of integrationl embedding and linking. Embedded information becomes a part of the other file and is not updated if the source file is updated. Linked information is kept separate; a connection between the two files is made, but it does not become part of the other file. Certain PDF files can be opened by Word by using the default conversion tool. Because the programs generally have the same layout, there are common paths to take information from one program into another program.","['What is the purpose of collaborative workspaces in Microsoft 365?', ' What is the difference between embedded and linked information in Microsoft 365?', ' What is the role of the default conversion tool in Microsoft 365?', ' What are the common paths to take information from one program into another program in Microsoft 365?', ' How does Microsoft 365 allow easy integration between applications?', ' What is the main advantage of using Microsoft 365 for collaboration and integration?', 'How does Microsoft 365 handle changes in the source file when using embedded or linked information?']","[' The purpose of collaborative workspaces in Microsoft 365 is to allow users from various physical locations to work together efficiently.', ' Embedded information becomes a part of the other file and is not updated if the source file is updated. Linked information is kept separate; a connection between the two files is made, but it does not become part of the other file.', ' The default conversion tool in Microsoft 365 is used to open certain PDF files by Word.', ' Common paths to take information from one program into another program in Microsoft 365 include the use of the default conversion tool and the programs generally having the same layout.', 'Microsoft 365 allows easy integration between applications by design, as it uses Office, which is designed to allow easy integration between applications.', 'The main advantage of using Microsoft 365 for collaboration and integration is its ability to allow users from various physical locations to work together efficiently.', 'Microsoft 365 handles changes in the source file when using embedded or linked information by keeping the linked information separate and not updating it if the source file is']"
15.2 Microsoft Word: Integration with Microsoft Excel and Microsoft Access," Integrating Word into Excel has some drawbacks as Excel is meant more for data rather than text.  However, methods for importing Excel content into Word files include many copy-and-paste options, as well as the ability to insert a linked object.  The process for linking or embedding Excel charts into a Word file is similar to linking or embedding tables of data. You can choose to display the information as an icon in the Word document rather than showing an image of the linked or embedded information. You can import Access tables into Word, but this is typically not advised, as Access databases can be quite lengthy.","[' What are the drawbacks of integrating Word into Excel?', ' How can you import Excel content into Word files?', ' What are the steps to link or embed Excel charts into a Word file?', 'Why is it not advised to import Access tables into Word?', ' How can you display information as an icon in the Word document rather than showing an image of the linked or embedded information?']","[' The drawbacks of integrating Word into Excel include the fact that Excel is designed for data rather than text.', 'You can import Excel content into Word files through copy-and-paste options or by inserting a linked object.', 'The process for linking or embedding Excel charts into a Word file involves choosing to display the information as an icon in the Word document rather than showing an image of the linked or embedded information.', ' Access tables in Access databases can be quite lengthy, and importing them into Word is typically not advised.', 'You can display information as an icon in the Word document rather than showing an image of the linked or embedded information by choosing to display the information as an icon in the Word document.']"
2.1 Software Basics,"Software is the lifeblood of a computer system that gets work done personally and in the business world.  Word processing applications are used to create text-based documents such as memos, letters, and reports.  Spreadsheet applications are used to work with data, especially numerical data.  Presentation applications are used to create slides that combine text and visuals to be shared in a presentation.  Specialized applications include programs that are used only in certain disciplines or occupations.  Installing and maintaining software is an important skill to have in today business world and beyond.","[' What is software?', ' What are some examples of software applications?', 'What is the difference between a word processing application, a spreadsheet application, and a presentation application?', ' What are specialized applications?', ' What is the importance of installing and maintaining software?']","[' Software is the programmes or applications that run on a computer and perform various tasks.', ' Examples of software applications include word processing applications (like Microsoft Word), spreadsheet applications (like Microsoft Excel), presentation applications (like PowerPoint), and specialized applications (like specific business software).', ' Word processing applications are used to create text-based documents, spreadsheet applications are used to work with numerical data, and presentation applications are used to create slides that combine text and visuals.', 'Specialized applications are programs that are used only in certain disciplines or occupations.', ' Installing and maintaining software is an important skill because it allows users to use the software effectively and efficiently, and it ensures that the software is up-to-date and compatible with the hardware and operating system.']"
2.2 Files and Folders,"Some best practices for organizing and cleaning your files include never storing files on your desktop, removing files from the download folder, and using descriptive folder names. The different types of files include document, worksheet, presentation, and graphics files.  Files can be managed, shared, organized, and stored in the cloud using the applications provided by Google or Microsoft.","[' What are some best practices for organizing and cleaning your files?', ' What are the different types of files?', 'How can files be managed, shared, organized, and stored in the cloud using the applications provided by Google or Microsoft?']","[' Some best practices for organizing and cleaning your files include never storing files on your desktop, removing files from the download folder, and using descriptive folder names.', ' The different types of files include document, worksheet, presentation, and graphics files.', ' Files can be managed, shared, organized, and stored in the cloud using the applications provided by Google or Microsoft.']"
2.3 Communication and Calendar Applications, Communication in organizations today is facilitated with technology.  Many applications include features to facilitate communication across time zones and borders. Email applications such as Outlook and Gmail make it possible to communicate and to send files via the internet.  Instant chat/messaging platforms such as Microsoft Teams and Slack have been used to create virtual workspaces for teams in organizations.  Productivity in teams can be enhanced by using calendar applications to manage team meetings and project tasks.,"['What is the main difference between email and instant messaging?', ' How do calendar applications help in managing team meetings and project tasks?', ' What are the features of Microsoft Teams and Slack that make them suitable for virtual workspaces?', 'What are the benefits of using calendar applications in organizations?', ' How does the use of calendar applications in organizations enhance productivity?']","[' Email is a form of communication that involves sending and receiving of documents, while instant messaging is a form of communication that involves real-time text communication.', ' Calendar applications help in managing team meetings and project tasks by allowing team members to schedule meetings, set reminders for tasks, and view the schedule of other team members.', ' The features of Microsoft Teams and Slack that make them suitable for virtual workspaces include the ability to create channels for different teams, share files and documents, and have real-time text communication.', 'The benefits of using calendar applications in organizations include improved communication, increased productivity, and better coordination of team activities.', ' The use of calendar applications in organizations enhances productivity by allowing team members to plan their work, manage their time, and coordinate their activities. It also helps in reducing the time spent on searching for information and meeting people, thereby increasing efficiency.']"
2.4 Essentials of Microsoft 365," Applications in the Office suite have generally the same layout. The options to customize files are arranged on the ribbon by tabs based on the usage.  The Save, Save As, Open, and Print options are common among all applications.  By using the settings options in the applications, you can customize the view and the ribbon to meet your needs.","[' What is the main difference between Microsoft Word, Excel, and PowerPoint?', ' What are the common options found on the ribbon in all Microsoft Office applications?', 'How can you customize the view and the ribbon in Microsoft Office applications?', 'What are the benefits of using the Save, Save As, Open, and Print options in all Microsoft Office applications?', 'How does the layout of the Office suite applications generally differ from one another?']","[' Word is a word processing application, Excel is a spreadsheet application, and PowerPoint is a presentation application.', 'The common options found on the ribbon in all Microsoft Office applications include File, Edit, View, Insert, Format, Tools, and Help.', 'You can customize the view and the ribbon in Microsoft Office applications by going to the File menu, selecting Options, and then choosing the Customize Ribbon option.', ' The Save, Save As, Open, and Print options are common among all Microsoft Office applications because they allow you to save your work, save your work with a different name, open previously saved files, and print your work.', 'The layout of the Office suite applications generally differ from one another because they are designed to work together as a suite, with Word for writing, Excel for calculations, and PowerPoint for presentations.']"
2.5 Essentials of Google Workspace,"Apps in Workspace include Docs, Sheets, and Slides. These apps are similar in many ways to their Microsoft counterparts. Google has some of the same functionality that you will find in Microsoft, but items may use different terminology.  A unique feature of creating files in Google is that the files are automatically saved in your Drive in the cloud. Commands and settings in Google are arranged in menus, with the more frequently used commands appearing as icons on the toolbar.","[' What are the apps in Google Workspace?', 'How are Google Workspace apps similar to their Microsoft counterparts?', ' What is the unique feature of creating files in Google?', ' How are commands and settings in Google arranged in menus?']","['The apps in Google Workspace include Docs, Sheets, and Slides.', ' Google Workspace apps are similar in many ways to their Microsoft counterparts, as they share similar functionalities and use similar terminology.', ' The unique feature of creating files in Google is that the files are automatically saved in your Drive in the cloud.', 'Commands and settings in Google are arranged in menus, with the more frequently used commands appearing as icons on the toolbar.']"
2.6 Collaboration,Collaboration and teamwork are essential aspects of today's workplace. Both can be fostered through technology. Sharing platforms such as OneDrive and Drive make it possible to collaborate and track teamwork across various applications. Today's companies expect workers to treat videoconferencing with the same level of professionalism as in-office meetings.  Companies use popular software programs such as Zoom and Microsoft Teams to run videoconferences. You can share and collaborate on documents through editing and commenting functions.,"[' What is collaboration and teamwork?', 'How can technology be used to foster collaboration and teamwork?', ' What are some examples of sharing platforms that allow for collaboration and teamwork?', 'What is the role of videoconferencing in todayâ\x80\x99s workplace?', ' What are some examples of software programs that are used to run videoconferences?', ' How can you share and collaborate on documents through editing and commenting functions?']","[' Collaboration is the process of working together to achieve a common goal. Teamwork is the ability to work together as a team to achieve a common goal.', 'Technology can be used to foster collaboration and teamwork by enabling communication, sharing files, and tracking teamwork.', 'Examples of sharing platforms that allow for collaboration and teamwork include OneDrive, Google Drive, Dropbox, and SharePoint.', 'Videoconferencing is a crucial part of todayâ\x80\x99s workplace as it allows for real-time communication and collaboration, enhancing teamwork and productivity.', ' Examples of software programs that are used to run videoconferences include Zoom, Microsoft Teams, Google Meet, and Cisco Webex.', 'You can share and collaborate on documents through editing and commenting functions. For example, you can edit a document in real-time, add comments to specific parts of the document, and see who has made what changes.']"
3.1 Navigating Microsoft Word," Word's functions and features are located in customizable tabs at the top of the user interface. The most frequently used tabs include Home (to set document styles), Insert (to insert graphics or other elements), Layout (to adjust margins and page settings), Review (to use comments and track change), and View (to adjust how you see a document).  The Navigation pane is a sidebar that allows the users to view the document in various ways. It gives the option to see an outline of the document, see thumbnails of the pages, and lets users find and replace text.","[' What are the five most frequently used tabs in Microsoft Word?', ' What are the three ways to view a document in Microsoft Word?', ' What is the Navigation pane in Microsoft Word?', 'How do you find and replace text in Microsoft Word?', ' What are the benefits of using comments and track change in Microsoft Word?']","[' The five most frequently used tabs in Microsoft Word are Home, Insert, Layout, Review, and View.', ' The three ways to view a document in Microsoft Word are to see an outline of the document, see thumbnails of the pages, and find and replace text.', ' The Navigation pane in Microsoft Word is a sidebar that allows the users to view the document in various ways. It gives the option to see an outline of the document, see thumbnails of the pages, and lets users find and replace text.', ' To find and replace text in Microsoft Word, you can use the Find and Replace function in the Home tab.', 'The benefits of using comments and track change in Microsoft Word include the ability to collaborate with others, keep track of changes made to the document, and review the history of the document.']"
3.2 Formatting Document Layout in Microsoft Word,"Document formatting includes page setup configurations, such as paper size, page margins, orientation, and the use of columns or sections.  Section breaks allow different formatting to be applied to different sections of a document.","[' What is the purpose of page setup configurations in Microsoft Word?', 'What are the different types of page margins in Microsoft Word?', ' How do you change the orientation of a document in Microsoft Word?', 'What is the difference between using columns and sections in Microsoft Word?']","[' The purpose of page setup configurations in Microsoft Word is to control the layout of the document, including the paper size, page margins, orientation, and the use of columns or sections.', ' The different types of page margins in Microsoft Word include left margin, right margin, top margin, and bottom margin.', 'To change the orientation of a document in Microsoft Word, you can use the ""Orientation"" option in the ""Page Setup"" dialog box.', 'The difference between using columns and sections in Microsoft Word is that columns allow you to divide a page into multiple columns, while sections allow you to divide a document into multiple sections with different page setups.']"
3.3 Formatting Document Content in Microsoft Word," Options for formatting font types, sizes, and styles are on the Home tab. Using appropriate document formatting helps make business documents more readable. The Layout tab is used for modifying paragraph styles in a document., Headings are a good tool for organizing your document, can be viewed in the Navigation pane, and can be used to make a table of contents.,When arranging objects such as images, graphs, charts, or tables around your text, use text wrapping settings that optimize the purpose of the graphic.","['What are the three ways to format font types, sizes, and styles in Microsoft Word?']","['The three ways to format font types, sizes, and styles in Microsoft Word are through the Home']"
3.4 Collaborative Editing and Reviewing in Microsoft Word,"The Review tab includes proofing tools like spelling and grammar check, commenting, Track Changes, and document protection.  The Editor tool conducts deep grammar and style checks on your document.","[' What is the purpose of the Review tab in Microsoft Word?', ' What are the features of the Review tab that are used for proofing tools?', ' What is the purpose of the Editor tool in Microsoft Word?', ' What is the function of the Track Changes feature in Microsoft Word?', 'What is the purpose of the document protection feature in Microsoft Word?']","['The Review tab in Microsoft Word is used for proofing tools like spelling and grammar check, commenting, Track Changes, and document protection.', 'The features of the Review tab that are used for proofing tools include spelling and grammar check, commenting, Track Changes, and document protection.', ' The Editor tool in Microsoft Word is used for deep grammar and style checks on your document.', 'The Track Changes feature in Microsoft Word allows users to see who made changes to a document and what those changes were.', ' The document protection feature in Microsoft Word is used to prevent unauthorized changes to a document.']"
3.5 Document Design," Themes are color and design schemes that autoformat document styles. The user can modify the theme to their liking by modifying the styles.  You can use the Page Background command group tools to make large changes to your whole document, such as changing the background of your page and applying a watermark. These are options are found on the Design tab.","[' What is the purpose of themes in Microsoft Word?', 'How can you modify the theme to your liking?', ' What are the options found on the Design tab?', 'What are the benefits of using the Page Background command group tools?', ' What is the difference between the Page Background command group tools and the Page Layout command group tools?']","[' The purpose of themes in Microsoft Word is to autoformat document styles, allowing the user to modify the styles to their liking.', ' You can modify the theme to your liking by modifying the styles.', ' The options found on the Design tab include features such as changing the background of your page and applying a watermark.', 'The benefits of using the Page Background command group tools include the ability to make large changes to your whole document, such as changing the background of your page and applying a watermark.', 'The Page Background command group tools are used to change the background of your page and apply a watermark, while the Page Layout command group tools are used to adjust the layout of your page, such as changing the margins and headers/footers.']"
3.6 Navigating Google Docs,"Docs has a menu protocol similar to other word processing applications, including File, Edit, View, Insert, Format, and Tools menus. The commands in each menu have similarities to the ones in Word, but Docs also offers unique features and abilities, such as the Explore command. Docs also features the action bar, which contains some of the more frequently used tools in Docs.  In order to create a new Doc, you must log in to your account and access Drive.","['What are the similarities and differences between the menus in Google Docs compared to other word processing applications?', 'What are the unique features and abilities of Google Docs?', 'How do you create a new Google Doc?']","['The similarities between Google Docs menus and other word processing applications include the common use of File, Edit, View, Insert, Format, and Tools menus. The commands in each menu are similar to those in Word. The differences lie in the unique features and abilities of Google Docs, such as the Explore command and the action bar.', "" Google Docs' unique features and abilities include the Explore command, which allows users to search for and insert content from other sources, and the action bar, which contains some of the most frequently used tools in Docs."", ' To create a new Google Doc, you must first log in to your Google account and access Google Drive. After accessing Drive, you can click on the ""New"" button to create a new document.']"
