chapter,Chapter Content,Questions,Answers
3.7 Formatting Layout and Content in Google Docs,"All document formatting in Docs is done by using the action bar or the Format menu. The functionality of the formatting tools is similar to Word, although where the formatting tools are located can be a bit different.  Docs offers section breaks that enable the user to differentiate the formatting from one part of the document to the next. The configuration options are minimalistic in nature, which makes Docs very user-friendly.","['What is the main difference between the action bar and the Format menu in Google Docs?', 'What is a section break in Google Docs?', 'How can you access the review for this chapter?', ' What are the configuration options for page setup in Google Docs?']","["" The action bar provides quick access to common formatting options, while the Format menu offers more detailed control over the document's appearance."", 'A section break in Google Docs is a line that separates different parts of the document. It allows you to apply different formatting to different sections of the document.', ' You can access the review for this chapter at openstax.org.', 'The configuration options for page setup in Google Docs include options for page orientation, margins, headers, footers, and page numbers.']"
3.8 Collaborative Editing and Reviewing in Google Docs, The Tools menu in Docs contains many of the same functions and features as the Tools menu in Word. The Suggesting mode in Docs allows for users to work on one document simultaneously.,"[' What is the purpose of the Suggesting mode in Google Docs?', 'How does the Tools menu in Google Docs differ from the Tools menu in Word?', 'What are some practical applications of collaborative editing and reviewing in Google Docs?', ' How does the Suggesting mode in Google Docs improve the efficiency of team collaboration?', 'What are the benefits of using Google Docs for collaborative editing and reviewing?', 'Can you provide an example of a time when you used Google Docs for collaborative editing and reviewing?']","[' The purpose of the Suggesting mode in Google Docs is to allow multiple users to work on the same document simultaneously, providing real-time feedback and suggestions.', 'The Tools menu in Google Docs differs from the Tools menu in Word by including additional features such as the Suggesting mode and the ability to add collaborators.', ' Some practical applications of collaborative editing and reviewing in Google Docs include team projects, research collaborations, and document sharing and review.', 'The Suggesting mode in Google Docs improves the efficiency of team collaboration by allowing multiple users to work on the same document simultaneously, providing real-time feedback and suggestions.', ""The benefits of using Google Docs for collaborative editing and reviewing include the ability to work on a document simultaneously, access to real-time feedback, and the ability to review and comment on others' work."", 'An example of a time when I used Google Docs for collaborative editing and reviewing was during a team project where we needed to share and revise a document simultaneously. We used Google Docs to work on the document, provide feedback, and make revisions in real-time.']"
3.9 Versions and Version History,"Both Docs and Word have versioning capabilities that can save and restore previous versions of your document. Docs frequently autosaves your document, capturing minute-by-minute changes. These versions can be accessed, named, copied, and restored, which gives the user much flexibility when it comes to keeping track of different versions.  Word versioning only occurs if you keep your document stored on one of its cloud services like OneDrive or SharePoint. It contains many of the same features as Docs versioning. ","['What is the purpose of versioning in Docs and Word?', ' How does Docs autosave work?', ' What are the features of Word versioning that are similar to Docs versioning?', ' How can you access, name, copy, and restore versions in Docs?', 'What are the benefits of having a version history in Docs and Word?']","[' The purpose of versioning in Docs and Word is to allow users to save and restore previous versions of their document.', 'Docs autosaves your document every 15 minutes, capturing minute-by-minute changes. These autosaved versions can be accessed, named, copied, and restored.', 'Word versioning in Docs contains many of the same features as autosaving, including the ability to access, name, copy, and restore versions.', "" You can access, name, copy, and restore versions in Docs by navigating to the 'File' menu, selecting 'Info', and then clicking on the 'Version History' tab."", 'The benefits of having a version history in Docs and Word include the ability to keep track of different versions, revert to previous versions if necessary, and compare changes between versions.']"
4.1 Microsoft Word: Advanced Formatting Features,"Word includes some advanced configuration settings, such as the Word Options dialog box. This dialog box is full of different categories of settings, including General settings, Display settings, Proofing customizations, and the Advanced tab, which lets you configure a vast array of settings of different categories. Page numbers in Word are easy to add and highly configurable. They have preformatted graphical designs, styles, and numbering systems.  Headers and footers can be inserted into Word documents using the tools on the Insert tab. As with page numbers, headers and footers can be customized to meet your needs.  Types of lists include numbered, lettered, or bulleted. Each type of list has multilevel capabilities.","['What are the advanced configuration settings in Microsoft Word?', 'How can you add and configure page numbers in Word?', ' What are the tools on the Insert tab in Word?', ' What are the types of lists in Word?', 'How can you customize headers and footers in Word?', ' What are the multilevel capabilities of each type of list in Word?', ' What is the purpose of the Word Options dialog box?', ' How do you insert a table in Word?', 'What are the different types of fields in Word?', ' How can you insert a hyperlink in Word?', ' What is the purpose of the Bookmarks toolbar in Word?']","[' Advanced configuration settings in Microsoft Word include options such as Word Options dialog box, Display settings, Proofing customizations, and the Advanced tab.', 'You can add and configure page numbers in Word by using the Page Layout dialog box. It has preformatted graphical designs, styles, and numbering systems.', ' The tools on the Insert tab in Word include features such as tables, pictures, fields, hyperlinks, bookmarks, and quick parts.', 'The types of lists in Word include numbered, lettered, or bulleted.', ' You can customize headers and footers in Word by using the Header and Footer dialog box.', 'The multilevel capabilities of each type of list in Word include the ability to create nested lists.', ' The Word Options dialog box is used to configure various settings for Microsoft Word.', 'You can insert a table in Word by selecting Insert > Table from the menu.', 'The different types of fields in Word include date and time fields, page fields, and document property fields.', ' You can insert a hyperlink in Word by selecting Insert > Hyperlink from the menu.', ' The Bookmarks toolbar in Word is a toolbar that contains bookmark buttons. It allows you']"
4.2 Working with Graphics and Text Tools in Microsoft Word,"Tables can be inserted into the document to summarize information into rows and columns. The tables can be customized with a wide variety of styles, colors, and fonts.  You may insert images, shapes, SmartArt, charts, and screen captures into Word using the tools in the Illustrations command group. SmartArt is a tool that lets you design different types of organizational charts, such as process and hierarchy charts.  The Text command group contains commands that let you insert autogenerated fields into your document, like Quick Parts, Signature Line, and Date & Time. It also has text-designing tools like Drop Cap, WordArt, and Text Box.  Word also has a large collection of symbols and equations that can be inserted in the document.","[' What is the purpose of the Tables command in Microsoft Word?', 'How can you customize the style, color, and font of a table in Word?', ' What are the different types of images, shapes, and charts that can be inserted into a Word document?', ' What is the purpose of the Text command group in Microsoft Word?', 'What are the different types of text-designing tools available in Word?', ' How can you insert autogenerated fields into a Word document?', ' What is the purpose of the Quick Parts in Word?', ' What is the purpose of the Signature Line in Word?']","['The purpose of the Tables command in Microsoft Word is to insert tables into the document, which can be used to summarize information into rows and columns.', 'You can customize the style, color, and font of a table in Word by selecting the table, then going to the Table Design tab in the Home tab.', ' The different types of images, shapes, and charts that can be inserted into a Word document include images, shapes, SmartArt, charts, and screen captures.', 'The Text command group in Microsoft Word contains commands that let you insert autogenerated fields into your document, such as Quick Parts, Signature Line, and Date & Time.', 'The different types of text-designing tools available in Word include Drop Cap, WordArt, and Text Box.', 'You can insert autogenerated fields into a Word document by going to the Insert tab, then selecting Quick Parts, Signature Line, or Date & Time.', 'The purpose of the Quick Parts in Word is to insert pre-defined text or graphics into your document.', 'The Signature Line in Word is a field that automatically inserts the name of the person who is typing the document.']"
4.3 Managing Long Documents in Microsoft Word,"The Pages command group has the Page Break, Blank Page, and Cover Page commands. These tools are used for adding and managing pages in your document.  The Format Painter is a useful tool that lets users copy the exact formatting from one section of text and apply it to another place in the document. The References tab contains many useful tools for navigating long documents. From this tab, you can generate a table of contents, a table of figures, and add footnotes and endnotes.  Adding bookmarks helps readers easily navigate within a long document.","[' What are the three commands in the Pages command group?', ' What is the purpose of the Format Painter tool?', 'What are the tools available on the References tab?', ' What is the purpose of adding bookmarks in a document?', ' How can the Format Painter tool be used in a document?', ' What is the difference between a table of contents, a table of figures, and a footnote?', ' How can the References tab be used to generate a table of contents?', ' How can the References tab be used to generate a table of figures?', ' How can the References tab be used to add footnotes?']","[' The three commands in the Pages command group are Page Break, Blank Page, and Cover Page.', ' The Format Painter tool is used to copy the exact formatting from one section of text and apply it to another place in the document.', ' The tools available on the References tab include generating a table of contents, a table of figures, adding footnotes, and adding endnotes.', 'The purpose of adding bookmarks in a document is to allow readers to easily navigate within the document.', ' The Format Painter tool can be used by selecting the text you want to copy the formatting from, clicking on the Format Painter tool in the Home tab, and then selecting the text where you want to apply the formatting.', 'A table of contents is a list of headings in a document, a table of figures is a list of figures and their captions, and a footnote is a reference or comment that is placed at the bottom of a page. An endnote is a reference or comment that is placed at the end of a document.', ' The References tab can be used to generate a table of contents by clicking on the Table of Contents button.', 'The References tab can be used to generate a table of figures by clicking on the Table of Figures button.', '9. The References tab can be used to add footnotes by clicking on the Footnotes button and then following the prompts to add a footnote']"
4.4 Google Docs: Enhanced Formatting Features,"Docs gives the user a few ways to customize page numbers in the document.  Headers and footers can be added to the Doc and formatted using the tools in the action bar.  Making multilevel lists in Docs is similar to the same process in Word. But Docs also has checklists, which are unique to Docs and are a form of bulleted list.","[' What are the ways to customize page numbers in Google Docs?', 'How can headers and footers be added and formatted in Google Docs?', 'How is making multilevel lists in Google Docs similar to the same process in Microsoft Word?', 'What is a unique feature of Google Docs that is not present in Microsoft Word?']","[' Google Docs allows users to customize page numbers by going to ""Page setup"" in the ""Page"" menu.', ' Headers and footers can be added and formatted in Google Docs by going to ""Page setup"" in the ""Page"" menu and selecting ""Headers & footers"".', ' Making multilevel lists in Google Docs is similar to the same process in Microsoft Word. You can create a list by pressing ""Enter"" after typing your list item, and then pressing ""Tab"" to indent the list.', ' One unique feature of Google Docs that is not present in Microsoft Word is the ""checklists"", which are a form of bulleted list that can be checked off when completed.']"
4.5 Working with Graphics and Text Tools in Google Docs,"Docs interactive character map allows you to search for symbols and special characters using text, Unicode references, or by drawing it.  With the Drawings tool, the user can easily create a custom shape and insert it into their Doc. Drawings has some SmartArt capabilities, but they are not as robust as Word.  Tables are formed in almost exactly the same way as in Word: by having a drop-down menu with an interactive row and column designer.","[' What is the purpose of the Docs interactive character map?', 'How does the Drawings tool in Google Docs work?', 'What are the differences between the Drawings tool and Wordâ\x80\x99s SmartArt capabilities?', 'How are tables created in Google Docs?']","[' The Docs interactive character map allows users to search for symbols and special characters using text, Unicode references, or by drawing it.', 'The Drawings tool in Google Docs allows users to easily create a custom shape and insert it into their Doc.', "" The Drawings tool in Google Docs is not as robust as Wordâ\x80\x99s SmartArt capabilities. It lacks some of the features that are present in Word's SmartArt."", ' Tables are created in Google Docs in almost exactly the same way as in Word: by having a drop-down menu with an interactive row and column designer.']"
4.6 Managing Long Documents in Google Docs, The Paint format command in Docs is the same as Format Painter in Word. It can copy text formatting to apply it to another area of the document.  Hyperlinks and bookmarks can be used the same way in Docs as in Word; they help the user navigate the document. ,"['What is the Paint format command in Docs?', ' How does the Paint format command in Docs differ from the Format Painter in Word?', ' What is the purpose of section breaks and headings in producing tables of contents automatically?', 'How can you use hyperlinks and bookmarks in Docs the same way as in Word?', ' What is the purpose of the Paint format command in Docs?', ' How does the Paint format command in Docs differ from the Format Painter in Word?', 'What is the importance of section breaks and headings in producing tables of contents automatically?', 'How can you use hyperlinks and bookmarks in Docs the same way as in Word?']","[' The Paint format command in Docs is used to apply the formatting of a selected area to another area of the document.', 'The Paint format command in Docs is the same as the Format Painter in Word, as it can copy text formatting to apply it to another area of the document.', 'Section breaks and headings are important for producing tables of contents automatically because they help organize the document and make it easier to navigate.', ' Hyperlinks and bookmarks can be used the same way in Docs as in Word; they help the user navigate the document by providing quick access to specific parts of the document.', 'The Paint format command in Docs is used to apply the formatting of a selected area to another area of the document.', ' The Paint format command in Docs is the same as the Format Painter in Word, as it can copy text formatting to apply it to another area of the document.', 'Section breaks and headings are important for producing tables of contents automatically because they help organize the document and make it easier to navigate.', ' Hyperlinks and bookmarks can be used the same way in Docs as in Word; they help the user navigate the document by providing quick access to specific parts of the document.']"
5.1 Creating Different Document Types in Microsoft Word,"Being able to create different types of documents in Word is an important skill. You can either use a template or create them from scratch.  Although many people use email, printed business memos are still common, and the way they are composed is important to know.  It is also important to know how to create and format documents on letterhead and printed envelopes. Letterheads display your name and contact information, while printed envelopes help add a look of professionalism to your communication.  Business cards can be designed in Word and printed by yourself, or by a printing company using cardstock paper. They display your contact information.  Brochures and flyers are forms of print advertising that can also be used digitally. â¢ Invoices always contain what you or your company is billing a client for. Microsoft has a large number of templates you can create an invoice from. â¢ A business plan usually has a standard layout, which a template can help you with. But it can be he","['What are the different types of documents that can be created in Microsoft Word?', ' How can you create a document from scratch in Word?', ' What are the benefits of using templates in Word?', ' What is the purpose of letterhead and printed envelopes in business communication?', 'How can you design and print business cards in Word?', ' What are brochures and flyers, and how can they be used for digital and print advertising?', ' What is an invoice and how can it be created in Microsoft Word?', ' What is a business plan and how can it be created?', ' What is the standard layout of a business plan?']","[' Different types of documents in Word include email, printed business memos, letterhead and printed envelopes, business cards, brochures, flyers, invoices, and business plans.', 'You can create a document from scratch in Word by selecting ""Blank Document"" from the ""File"" menu.', 'Templates in Word allow you to save a set of pre-formatted settings that you can use to create multiple documents. This saves time and ensures consistency in your documents.', 'Letterheads display your name and contact information, while printed envelopes add a look of professionalism to your communication.', ' You can design and print business cards in Word by creating a new document, then using the ""Business Card"" template.', 'Brochures and flyers are forms of print advertising that can be used for both digital and print advertising. They often contain text, images, and other visual elements.', ' An invoice in Word can be created using a template, which contains sections for the billing information, items being billed, and any applicable taxes or fees.', ""A business plan is a detailed plan that outlines your company's financials, goals, and strategies. It usually includes sections for market analysis, competition, and your company's unique selling proposition."", ' The standard layout of a business plan typically includes sections for the purpose of the plan, objectives, market analysis, competition, organization, and financial pro']"
5.2 Mail Merge in Microsoft Word,"Mail merge is a tool in Word that can personalize dozens or hundreds of form letters. It allows the user to designate merge fields for any type of customized client data, such as names, addresses, or other details.  To do a mail merge, you first need to create your main document, or the document that contains the letter or information going to your recipients. You can temporarily designate where the custom fields will be by highlighting them. Next, you need to create or access a source document. A source document is the place where you have all of your recipients information. The information you include here will go into the custom fields in the main document. You complete a mail merge by combining the main document and the source document. The resulting item will be the merged document. Word will create one letter for each recipient you designated in a single document.","['What is the purpose of mail merge in Microsoft Word?', 'How do you designate where the custom fields will be in the main document?', 'What is a source document in the context of mail merge?', 'What is the process of completing a mail merge?', 'What is the result of a merged document?']","['The purpose of mail merge in Microsoft Word is to personalize dozens or hundreds of form letters by inserting data from a source document into a main document.', ' You designate where the custom fields will be in the main document by highlighting them.', 'A source document is a place where you have all of your recipientsâ\x80\x99 information. The information you include here will go into the custom fields in the main document.', 'The process of completing a mail merge involves combining the main document and the source document. The resulting item will be the merged document. Word will create one letter for each recipient you designated in a single document.', ' The result of a merged document is a single document that contains one letter for each recipient you designated. Each letter is personalized with data from the source document.']"
5.3 Creating Forms in Microsoft Word," The Developer tab is part of Word's set of command groups, but it does not appear by default, and needs to be manually activated. It is used for making forms, macros, handling add-ons/templates, and other advanced processes.  Fillable forms are built using the tools in the Controls command group of the Developer tab. This command group contains options for content control fields, which are used for creating different types of questions for forms. The respondent uses the content control fields to answer the questions in the form. Creating a fillable form in Word is a multistep process. You should first create your questions, then choose the question types, add in the content control fields, then finally edit the properties for each question.","['What is the purpose of the Developer tab in Microsoft Word?', ' What are the tools in the Controls command group of the Developer tab used for?', 'What are the different types of questions that can be created using content control fields?', 'What is the multistep process for creating a fillable form in Word?', ' How do you manually activate the Developer tab in Word?', ' What is the purpose of content control fields in creating forms?', ' What is the difference between a fillable form and a non-fillable form?', 'What is the process for choosing the question types in creating a form?']","[' The Developer tab in Microsoft Word is used for making forms, macros, handling add-ons/templates, and other advanced processes.', 'The tools in the Controls command group of the Developer tab are used for creating different types of questions for forms.', ' The different types of questions that can be created using content control fields include text boxes, drop-down boxes, and check boxes.', 'The multistep process for creating a fillable form in Word includes creating the questions, choosing the question types, adding in the content control fields, and finally editing the properties for each question.', ""To manually activate the Developer tab in Word, you need to go to the 'File' tab, click on 'Options', then 'Customize Ribbon', and finally check the box for 'Developer' under 'Main Tabs'."", ' The purpose of content control fields in creating forms is to allow the respondent to answer the questions in the form.', "" A fillable form is one where the respondent can fill in the answers, while a non-fillable form is one where the respondent can't change the answers after they've been filled in."", 'The process for choosing the question types in creating a form involves selecting the appropriate question type from the list of available question types.']"
