chapter,Chapter Content,Questions,Answers
5.4 Creating Different Document Types in Google Docs," Docs lets you create and publish your own templates. It does not have as many templates as Word in its default Template Gallery, but it does allow users to search through user-generated templates on the internet. There are no default templates in the Template Gallery for business memos, envelopes, business cards, flyers, brochures, or invoices, but these can all be made from scratch in Google Docs. ","['What does Docs let you create and publish your own templates?', ' How does Docs compare to Word in terms of the number of default templates available?', ' What are the limitations of Docs in terms of creating specific document types like business memos, envelopes, business cards, flyers, brochures, or invoices?', ' How can you create these specific document types in Google Docs?', 'Where can you access the review questions for this chapter?']","[' Docs lets you create and publish your own templates.', ' Docs does not have as many templates as Word in its default Template Gallery.', ' Docs does not have default templates for business memos, envelopes, business cards, flyers, brochures, or invoices.', ' These can all be made from scratch in Google Docs.', ' The review questions for this chapter can be accessed at openstax.org.']"
5.5 Creating Forms in Google Docs,"Forms is part of the Google workspace of software programs that allows the writer to send a form electronically, and automatically tabulates their answers. Google provides some templates that users can base their forms on. Forms also allows for creating forms from scratch. Users can choose from a wide array of question types, add multimedia questions, and apply different themes. The results from responses collected through a form can easily be downloaded into Sheets for data analysis.","['What is the purpose of Google Forms?', ' How can you create a form from scratch in Google Forms?', 'What are the different types of questions that can be added to a Google Form?', 'How can you add multimedia questions to a Google Form?', ' What are the different themes that can be applied to a Google Form?', 'How can you download the results from a Google Form into Google Sheets for data analysis?']","[' The purpose of Google Forms is to allow users to send a form electronically, and automatically tabulates their answers.', 'To create a form from scratch in Google Forms, users can go to the Google Forms website, click on the ""Create Form"" button, and follow the prompts to add questions and set up the form.', ' Google Forms allows for the creation of a variety of question types, including multiple-choice questions, checkbox questions, dropdown questions, and more.', 'Multimedia questions can be added to a Google Form by clicking on the ""Add media"" button and selecting the type of media you want to include.', 'Google Forms allows for the application of different themes to a form, including a variety of color schemes and layout options.', ' The results from responses collected through a Google Form can be downloaded into Google Sheets for data analysis by clicking on the ""Responses"" tab in the form, then clicking on the ""Download responses"" button.']"
5.6 Advanced Collaboration in Google Docs," You can share a document using an email or a shareable link. There are three types of shareable links: public links, anyone with the link, and restricted. Docs allows many users to edit and type in a document concurrently. This can be done with layers of permissions, from editor, to commenter, to reader. Comment history collects all comments into a sidebar. This can save time for the user because this way, they do not have to scroll through the entire document. ","[' What are the three types of shareable links in Google Docs?', 'How can you share a document in Google Docs?', ' What are the layers of permissions in Google Docs?', ' What is the purpose of the Comment History in Google Docs?', 'How can you edit and type in a document concurrently in Google Docs?', ' How does Google Docs handle concurrent editing?', ' What are the benefits of using Google Docs for collaboration?']","[' The three types of shareable links in Google Docs are public links, anyone with the link, and restricted.', 'You can share a document in Google Docs by using an email or a shareable link.', 'The layers of permissions in Google Docs are editor, commenter, and reader.', 'The purpose of the Comment History in Google Docs is to save time for the user by collecting all comments into a sidebar, so they do not have to scroll through the entire document.', 'You can edit and type in a document concurrently in Google Docs by using layers of permissions.', 'Google Docs handles concurrent editing by allowing multiple users to edit the same document at the same time.', 'Google Docs provides several benefits for collaboration, including the ability to share documents, collaborate on projects, and track changes']"
6.1 Presentation and Design Essentials,"Presentations are used in business to communicate information to both internal and external stakeholders. They are typically used to educate or train, sell an idea, or simply convey information to others. Understanding your audience should drive the purpose behind the presentation. This is to ensure the presentation is geared toward the audience.  Consistency and coherency are essential for creating a professional, finished presentation. Consistency means ensuring that the presentation has a unified look and feel. Coherency means that the presentation is logically unified and applies to both the slides and the presenter.It is important to create a plan or storyboard of the presentation, in the same way that it is important to outline an essay. A visual plan can ensure all key topics are covered and laid out in an effective manner.","[' What is the purpose of a presentation?', 'How does understanding your audience influence the purpose of a presentation?', ' What are the key principles of consistency and coherency in presentation design?', ' How does creating a plan or storyboard of a presentation differ from outlining an essay?', ' What are some tips for creating a professional, finished presentation?']","['The purpose of a presentation is to communicate information to both internal and external stakeholders.', 'Understanding your audience is crucial to ensure the presentation is geared toward that audience.', 'The key principles of consistency and coherency in presentation design are: consistency means ensuring the presentation has a unified look and feel, and coherency means that the presentation is logically unified and applies to both the slides and the presenter.', ' Creating a plan or storyboard of a presentation differs from outlining an essay in that it ensures all key topics are covered and laid out in an effective manner.', ' Some tips for creating a professional, finished presentation include ensuring the presentation is well-organized, using visual aids where appropriate, maintaining a consistent tone throughout, and ensuring the presentation is engaging and interactive.']"
6.2 Designing a Presentation in Microsoft PowerPoint,"The default upon opening a new PowerPoint presentation starts with a blank slide. You can also open an existing document or start from a template. Themes and templates can help create dynamic slides and slideshows. They can also help you save time by applying color palettes and layouts to an entire presentation.  The Home tab enables users to create new slides, add text, choose layouts, and customize paragraphs.  The Design tab enables users to select a common theme for slides and apply variants to each style. The View tab helps users to better understand how different view options can be used to build and review presentation content.","[' What is the default slide layout in PowerPoint?', 'How can you open an existing document or start from a template in PowerPoint?', ' What are the benefits of using themes and templates in PowerPoint?', ' How can you create new slides in PowerPoint?', 'How can you add text to a slide in PowerPoint?', 'How can you select a common theme for slides in PowerPoint?', 'How can you apply variants to each style in PowerPoint?', ' How can you use the View tab to better understand how different view options can be used to build and review presentation content?', 'What is the purpose of the Design tab in PowerPoint?']","[' The default slide layout in PowerPoint is Title Slide.', ' You can open an existing document or start from a template by clicking on ""Open"" in the File menu, or by clicking on ""New"" and then selecting a template from the list.', 'Themes and templates can help create dynamic slides and slideshows, save time by applying color palettes and layouts to an entire presentation, and provide a consistent look and feel across the presentation.', ' You can create new slides in PowerPoint by clicking on the ""New Slide"" button in the Home tab.', ' You can add text to a slide by clicking on the ""Type Text"" button in the Home tab, or by right-clicking on the slide and selecting ""Insert"" > ""Text Box"".', ' You can select a common theme for slides in PowerPoint by clicking on the ""Design"" tab, then selecting a theme from the ""Themes"" drop-down menu.', ' You can apply variants to each style in PowerPoint by clicking on the ""Design"" tab, then selecting a style from the ""Variants"" drop-down menu.', ' You can use the View tab to better understand how different view options can be used to build and review presentation content by clicking on the ""View"" tab, then selecting a view option from the drop-down menu.', 'The Design tab in PowerPoint allows you to select a common theme for slides and apply variants']"
6.3 Formatting Microsoft PowerPoint Slides: Layout and Design Principles," Adjusting the layout of the elements on a slide is an important skill. Formatting the layout includes arranging the text, graphics, and other objects on a slide. Design principles provide guidelines and rules of thumb to consider as users start to change and manipulate themes and layouts on slides.","['What is the purpose of formatting the layout of the elements on a slide?', ' What are the design principles that provide guidelines and rules of thumb to consider as users start to change and manipulate themes and layouts on slides?', ' How can you adjust the layout of the elements on a slide?', ' What are some examples of layout adjustments that can be made?', ' How can the design principles help users when they start to change and manipulate themes and layouts on slides?']","[' The purpose of formatting the layout of the elements on a slide is to ensure that the information is presented in a clear and effective manner.', ' Design principles provide guidelines and rules of thumb to consider as users start to change and manipulate themes and layouts on slides, such as: a. Consistency: The design should be consistent across all slides.b. Clarity: The information should be clear and easy to understand.c. Simplicity: The design should be simple and not overly complex.d. Engagement: The design should be engaging and interactive.', ' Adjusting the layout of the elements on a slide can be done by using the layout tools in Microsoft PowerPoint, such as:a. Arranging the objects: You can rearrange the objects on the slide by clicking and dragging them.b. Resizing the objects: You can resize the objects to fit the slide better.c. Changing the alignment: You can change the alignment of the objects to left, right, center, or justify.', ' Some examples of layout adjustments that can be made include:a. Aligning text: You can align the text to the left, right, center, or justify.b. Resizing objects: You can resize the objects to fit the slide better.c. Arranging objects: You can rearrange the objects on the slide to make the most effective use of space.', ' The design principles can help users when they start to change and manipulate themes and layouts on slides by providing a clear guideline on how to present information effectively. They can also help users to avoid common pitfalls, such as overcrowding the slide with']"
6.4 Adding Visuals and Features to Microsoft PowerPoint Slides,"When including data on slides or related text elements, tables can be used to neatly organize the information in a presentation. The Table tool is similar to inserting tables in Word. An impactful presentation includes visual elements such as images rather than just text. You can use images from your computer, images provided by PowerPoint, or images you find online.  The written (textual) information on a slide can be used to convey important details. However, keeping text to a minimum on each slide makes for a more effective presentation design. Symbols and equations can be easily inserted into slides when mathematical content is needed.  You can use the WordArt tool to enhance basic textual information by adding borders, shading effects, and other elements. â¢ Slides that include several visual elements are often more appealing. Using the tools in the Illustrations command group, you can insert shapes, pictures, and SmartArt into your slides.","[' What is the purpose of tables in PowerPoint presentations?', ' How do you insert an image into a PowerPoint slide?', 'What is the difference between textual and visual information on a slide?', ' How can you keep text on a slide to a minimum?', ' What is the purpose of the WordArt tool in PowerPoint?', ' How can you insert symbols and equations into a PowerPoint slide?', ' What is the purpose of the Illustrations command group in PowerPoint?', ' How can you use the Illustrations command group to insert shapes, pictures, and SmartArt into a slide?']","[' The purpose of tables in PowerPoint presentations is to neatly organize information in a presentation.', ' To insert an image into a PowerPoint slide, use the Insert Picture tool.', ' Textual information on a slide is used to convey important details, while visual elements such as images are used to enhance the presentation.', ""To keep text on a slide to a minimum, it's important to keep the content concise and relevant to the presentation."", ' The WordArt tool in PowerPoint allows you to enhance basic textual information by adding borders, shading effects, and other elements.', ' You can insert symbols and equations into a PowerPoint slide using the Equation Editor.', 'The Illustrations command group in PowerPoint is used to insert shapes, pictures, and SmartArt into a slide.', 'You can use the Illustrations command group to insert shapes, pictures, and SmartArt into a slide by selecting the desired elements from the group and clicking on the slide where you want to insert them.']"
6.5 Designing a Presentation in Google Slides,"Both Slides and PowerPoint have similar functionality when creating presentations. In some respects, Slides is considered more user friendly, with enhanced collaboration tools. Slides is a web-based program, which has both advantages and disadvantages. One advantage is that you can access your Slides files anywhere as long as you have internet access and access to your Google account. Slides can be exported to a PowerPoint file format, and vice versa. This is useful when working in a    workplace environment where one program is preferred over the other.","[' What are the similarities and differences between Google Slides and PowerPoint?', 'What are the advantages and disadvantages of using Google Slides?', 'How is Google Slides different from PowerPoint?', ' What is the purpose of exporting a Google Slides presentation to a PowerPoint file format?', 'In a workplace environment, what is the preferred program over the other?']","[' Similarities: Both Google Slides and PowerPoint are used for creating presentations. They both have similar functionalities such as adding text, images, and videos.Differences: Google Slides is a web-based program, which means it can be accessed from anywhere with an internet connection and a Google account. PowerPoint, on the other hand, is a desktop application that requires a separate installation.', ' Advantages of Google Slides: It has enhanced collaboration tools, and you can access your files from anywhere with internet access and a Google account. Disadvantages: It may not be as user-friendly as PowerPoint for some users.', ' Google Slides is different from PowerPoint in that it is a web-based program. This means you can access your files from anywhere with internet access and a Google account. PowerPoint is a desktop application that requires a separate installation.', 'The purpose of exporting a Google Slides presentation to a PowerPoint file format is to make it easier to work with other users who may be using PowerPoint. This is particularly useful in a workplace environment where one program is preferred over the other.', 'In a workplace environment, Google Slides would be preferred over PowerPoint due to its web-based nature and its enhanced collaboration tools.']"
6.6 Creating Google Slides: Layout and Text,You can modify text in Slides either by using the action bar or using the Format menu.  You can adjust the spacing of text on a slide in Google with the Align & Indent tool or the Line spacing tool found in the Format menu Borders and lines can be used to enhance the look of slide elements such as a list of information or images. You can add borders using the Format menu.The Arrange and Slide menus can be very helpful when finalizing your slides for a professional appearance. The tools in these menus help with lining up elements on the slide such as text boxes or images.,"[' What is the purpose of the Align & Indent tool in Google Slides?', ' How can you adjust the spacing of text on a slide in Google Slides?', 'What is the purpose of the Arrange and Slide menus in Google Slides?', 'How can you add borders to slide elements in Google Slides?', 'What is the difference between the action bar and the Format menu in Google Slides?']","[' The Align & Indent tool in Google Slides is used to adjust the alignment and indentation of text.', ' You can adjust the spacing of text on a slide in Google Slides by using the Line spacing tool found in the Format menu.', ' The Arrange and Slide menus in Google Slides are used to help with lining up elements on the slide such as text boxes or images.', 'You can add borders to slide elements in Google Slides by using the Format menu.', 'The action bar in Google Slides is used for quick access to text formatting options, while the Format menu provides more detailed control over text formatting.']"
6.7 Adding Visuals and Features to Google Slides," Images add visual interest to a presentation and enhance the audience's understanding of the content. Shapes can be used to create diagrams, highlight information, or add visual interest to a slide. They can also be used to create custom graphics or diagrams, or to illustrate a concept.  Tables can be used to organize and present data in a clear, concise manner. Charts can be used to visualize data in a clear and meaningful way. Slides makes it simple to insert one into a presentation.  Diagrams can be used to represent complex ideas, processes, or relationships in a visual and understandable format.Special characters can be used to add symbols, accents, or foreign characters to a slide. â¢ Links allow you to quickly navigate to other pages or websites from within your presentation. They can also be used to provide additional information or resources, or to allow the audience to access additional content related to the presentation. â¢ Adding video to your presentation can be","[' What are the different types of visuals that can be added to a Google Slides presentation?', ' How can you add a shape to a Google Slides presentation?', ' What are the benefits of using tables in a Google Slides presentation?', 'How can you visualize data in a Google Slides presentation?', 'What is the purpose of special characters in a Google Slides presentation?', 'How can you add a link to a Google Slides presentation?', 'What are the advantages of adding video to a Google Slides presentation?']","[' The different types of visuals that can be added to a Google Slides presentation include images, shapes, tables, charts, diagrams, and special characters.', "" You can add a shape to a Google Slides presentation by selecting the shape from the 'Insert' menu, then clicking on the slide where you want the shape to appear."", ' The benefits of using tables in a Google Slides presentation include organizing and presenting data in a clear, concise manner, allowing for easy comparison and analysis of data, and providing a visual representation of data.', ' You can visualize data in a Google Slides presentation by creating a chart, then inputting your data into the chart.', "" The purpose of special characters in a Google Slides presentation is to add symbols, accents, or foreign characters to a slide, enhancing the presentation's visual appeal and clarity."", ""You can add a link to a Google Slides presentation by selecting the text where you want the link to appear, then clicking on the 'Insert link' button."", "" The advantages of adding video to a Google Slides presentation include enhancing the presentation's visual appeal, adding interactivity, and providing additional context or information to the audience.""]"
7.1 Effective Presentation Skills,"To prepare for a presentation, you should consider the goals of the presentation, how long you have to present, and how you will interact with the audience before, during, and after the presentation. A strong opening statement or hook will get the audience engaged and interested in the rest of the presentation. Although there is no standard set of skills for being a good presenter, there are some common approaches that, with practice, will help you become a better public speaker.  Just as a strong opening statement is needed, an impactful closing statement can bring the presentation to a close in a memorable way for the audience.","[' What are the three key factors to consider when preparing for a presentation?', 'How does a strong opening statement or hook help to engage and interest the audience?', 'What are some common approaches that can help a person become a better public speaker?', 'What is the importance of an impactful closing statement in bringing a presentation to a close in a memorable way for the audience?']","[' The three key factors to consider when preparing for a presentation are the goals of the presentation, the time available, and how the audience will interact with the presenter.', ' A strong opening statement or hook can engage and interest the audience by setting the stage for the presentation and drawing their attention to the main points.', ' Some common approaches that can help a person become a better public speaker include clear, concise language, effective body language, engaging with the audience, and using visual aids.', 'An impactful closing statement plays a crucial role in bringing a presentation to a close in a memorable way for the audience. It should summarize the main points of the presentation, provide a final recap, and leave a lasting impression on the audience.']"
7.2 Finalizing a Slide Collection,"Color can be used to enhance a presentation and convey emotions.  There are a variety of ways to modify a theme used in a presentation. You can modify colors, fonts, and placement of elements on the slide. The Designer tool gives you options for adding variety and interest to your slides. When images are included on slides, you can customize the size and look of an image through various tools, including cropping, removing the background, and changing the transparency of the image.","[' What is the purpose of color in enhancing a presentation and conveying emotions?', 'How can you modify a theme used in a presentation?', ' What are the options available in the Designer tool for adding variety and interest to your slides?', 'How can you customize the size and look of an image through various tools, including cropping, removing the background, and changing the transparency of the image?']","[' Color can be used to highlight important points, create visual contrast, and convey emotions such as excitement, calmness, or anger.', 'You can modify colors, fonts, and placement of elements on the slide using the Designer tool.', 'The Designer tool provides options for adding variety and interest to your slides, such as changing the layout, adding animations, and customizing the background.', 'You can customize the size and look of an image through various tools, including cropping, removing the background, and changing the transparency of the image. For example, you can crop an image to remove unnecessary parts, remove the background to focus on the main object, or change the transparency to make the image semi-transparent.']"
